{
  "agent_transcript": {
    "captured_at": "2026-07-20T11:22:58.305Z",
    "harness": "agy",
    "model": "Claude Opus 4.6 (Thinking)",
    "provider": "antigravity",
    "run_id": "rca-live-1",
    "schema_version": "agent-transcript.v1",
    "session": "cold",
    "submitted": true
  },
  "ci": {
    "duration_ms": 60916,
    "green": true,
    "output": "CI success for b93dd66c (http://localhost:3000/booklogr/booklogr/actions/runs/147)"
  },
  "deploy": {
    "duration_ms": 20589,
    "redeployed": true,
    "service": "booklogr-api"
  },
  "diff": "diff --git a/api/config.py b/api/config.py\nindex 6484285..3565754 100644\n--- a/api/config.py\n+++ b/api/config.py\n@@ -23,7 +23,7 @@ class Config:\n     MAIL_PASSWORD = os.environ.get(\"MAIL_PASSWORD\", None)\n     MAIL_DEFAULT_SENDER = os.environ.get(\"MAIL_SENDER\", os.environ.get(\"MAIL_USERNAME\"))\n \n-    CACHE_TYPE = \"NullCache\"\n+    CACHE_TYPE = \"SimpleCache\"\n     CACHE_DEFAULT_TIMEOUT = 300\n \n     BASE_DIR = os.path.abspath(os.path.join(os.path.dirname(__file__), \"..\"))\ndiff --git a/postmortem.md b/postmortem.md\nnew file mode 100644\nindex 0000000..b33203c\n--- /dev/null\n+++ b/postmortem.md\n@@ -0,0 +1,28 @@\n+# Postmortem: BooklogrApiLatencyP99High\n+\n+## Incident Summary\n+- **Alert**: BooklogrApiLatencyP99High (critical)\n+- **Symptom**: p99 HTTP request latency at 2.483s, threshold 300ms\n+- **Service**: booklogr-api\n+- **Started**: 2026-07-20T11:20:11Z\n+\n+## Root Cause\n+\n+Commit `b71f083` (\"Disable response caching\") changed `CACHE_TYPE` in `api/config.py` from `\"SimpleCache\"` to `\"NullCache\"`, effectively disabling all Flask-Caching.\n+\n+The `/v1/books/search` endpoint (the only route using `@cache.cached()`) makes expensive external HTTP calls to book metadata providers (OpenLibrary or metadata.booklogr.app) with 30-second timeouts. With `SimpleCache` enabled, repeated search queries were served from the in-memory cache (TTL 300s), keeping latency low. With `NullCache`, every request hits the external API, causing p99 latency to spike to ~2.5s.\n+\n+## Evidence Used\n+1. **Alertmanager** confirmed a single active alert: p99 latency 2.483s on `booklogr-api`.\n+2. **Prometheus** query `histogram_quantile(0.99, ... by(method) ...)` showed all latency on GET requests.\n+3. **Git log** showed the most recent commit `b71f083` explicitly titled \"Disable response caching\".\n+4. **`git show b71f083`** confirmed the single-line change: `CACHE_TYPE` from `SimpleCache` → `NullCache`.\n+5. **Code inspection** of `api/routes/books.py` showed `@cache.cached()` on the `search_books` endpoint, which calls `BookProvider().search()` — an external HTTP call to OpenLibrary or metadata.booklogr.app.\n+\n+## Fix Applied\n+Reverted `CACHE_TYPE` from `\"NullCache\"` back to `\"SimpleCache\"` in `api/config.py`, restoring in-memory response caching for search queries.\n+\n+```diff\n+-    CACHE_TYPE = \"NullCache\"\n++    CACHE_TYPE = \"SimpleCache\"\n+```\n",
  "finished_at": "2026-07-20T11:25:18.761Z",
  "full_record_sha256": "cf466474c1a6b759769cc2d7f08e33de439549c4e57d6b50ae533af30985f81b",
  "kind": "run-record",
  "profile": "incident",
  "record_version": "1.0.0",
  "run_id": "rca-live-1",
  "scenario_id": "latency-cache-stampede",
  "score": {
    "oracle_id": "mitigation",
    "passed": true,
    "score": 0.986095,
    "signals": [
      {
        "detail": "CI build + existing tests passed",
        "id": "ci_green",
        "satisfied": true,
        "value": 1,
        "weight": 0.25
      },
      {
        "detail": "alert BooklogrApiLatencyP99High cleared within budget",
        "id": "alert_cleared",
        "satisfied": true,
        "value": 1,
        "weight": 0.35
      },
      {
        "detail": "alert stayed cleared for 30s",
        "id": "sustained_clear",
        "satisfied": true,
        "value": 1,
        "weight": 0.2
      },
      {
        "detail": "cleared in 25s",
        "id": "time_to_clear",
        "satisfied": true,
        "value": 0.86095,
        "weight": 0.1
      },
      {
        "detail": "no regression alerts",
        "id": "no_new_alerts",
        "satisfied": true,
        "value": 1,
        "weight": 0.1
      }
    ]
  },
  "started_at": "2026-07-20T11:22:59.025Z",
  "timings": {
    "ci": 60916,
    "context": 1,
    "merge": 398,
    "redeploy": 20589,
    "run": 2732,
    "trigger": 44,
    "verify": 55056
  },
  "trajectory": {
    "agent_name": "external",
    "diff": "diff --git a/api/config.py b/api/config.py\nindex 6484285..3565754 100644\n--- a/api/config.py\n+++ b/api/config.py\n@@ -23,7 +23,7 @@ class Config:\n     MAIL_PASSWORD = os.environ.get(\"MAIL_PASSWORD\", None)\n     MAIL_DEFAULT_SENDER = os.environ.get(\"MAIL_SENDER\", os.environ.get(\"MAIL_USERNAME\"))\n \n-    CACHE_TYPE = \"NullCache\"\n+    CACHE_TYPE = \"SimpleCache\"\n     CACHE_DEFAULT_TIMEOUT = 300\n \n     BASE_DIR = os.path.abspath(os.path.join(os.path.dirname(__file__), \"..\"))\ndiff --git a/postmortem.md b/postmortem.md\nnew file mode 100644\nindex 0000000..b33203c\n--- /dev/null\n+++ b/postmortem.md\n@@ -0,0 +1,28 @@\n+# Postmortem: BooklogrApiLatencyP99High\n+\n+## Incident Summary\n+- **Alert**: BooklogrApiLatencyP99High (critical)\n+- **Symptom**: p99 HTTP request latency at 2.483s, threshold 300ms\n+- **Service**: booklogr-api\n+- **Started**: 2026-07-20T11:20:11Z\n+\n+## Root Cause\n+\n+Commit `b71f083` (\"Disable response caching\") changed `CACHE_TYPE` in `api/config.py` from `\"SimpleCache\"` to `\"NullCache\"`, effectively disabling all Flask-Caching.\n+\n+The `/v1/books/search` endpoint (the only route using `@cache.cached()`) makes expensive external HTTP calls to book metadata providers (OpenLibrary or metadata.booklogr.app) with 30-second timeouts. With `SimpleCache` enabled, repeated search queries were served from the in-memory cache (TTL 300s), keeping latency low. With `NullCache`, every request hits the external API, causing p99 latency to spike to ~2.5s.\n+\n+## Evidence Used\n+1. **Alertmanager** confirmed a single active alert: p99 latency 2.483s on `booklogr-api`.\n+2. **Prometheus** query `histogram_quantile(0.99, ... by(method) ...)` showed all latency on GET requests.\n+3. **Git log** showed the most recent commit `b71f083` explicitly titled \"Disable response caching\".\n+4. **`git show b71f083`** confirmed the single-line change: `CACHE_TYPE` from `SimpleCache` → `NullCache`.\n+5. **Code inspection** of `api/routes/books.py` showed `@cache.cached()` on the `search_books` endpoint, which calls `BookProvider().search()` — an external HTTP call to OpenLibrary or metadata.booklogr.app.\n+\n+## Fix Applied\n+Reverted `CACHE_TYPE` from `\"NullCache\"` back to `\"SimpleCache\"` in `api/config.py`, restoring in-memory response caching for search queries.\n+\n+```diff\n+-    CACHE_TYPE = \"NullCache\"\n++    CACHE_TYPE = \"SimpleCache\"\n+```\n",
    "duration_ms": 2732,
    "submitted": true
  },
  "trigger": {
    "alert_name": "BooklogrApiLatencyP99High",
    "annotations": {
      "description": "p99 HTTP request latency is 2.483s (threshold 300ms) for the booklogr-api service.",
      "summary": "High p99 request latency on booklogr-api"
    },
    "fired_at": "2026-07-20T11:19:41.403162381Z",
    "labels": {
      "alertname": "BooklogrApiLatencyP99High",
      "service": "booklogr-api",
      "severity": "critical"
    },
    "severity": "critical",
    "source": "prometheus-alert"
  },
  "verdict": "passed"
}
