{
  "agent_transcript": {
    "captured_at": "2026-07-25T17:21:59.197Z",
    "harness": "agy",
    "model": "Gemini 3.6 Flash (High)",
    "provider": "antigravity",
    "run_id": "run-1784999648068",
    "schema_version": "agent-transcript.v1",
    "session": "cold",
    "submitted": true
  },
  "ci": {
    "duration_ms": 60966,
    "green": true,
    "output": "CI success for 2d7b2ef5 (http://localhost:3000/booklogr/booklogr/actions/runs/562)"
  },
  "deploy": {
    "duration_ms": 43300,
    "redeployed": true,
    "service": "booklogr-api"
  },
  "diff": "diff --git a/api/routes/books.py b/api/routes/books.py\nindex 2f26c2a..d8c071b 100644\n--- a/api/routes/books.py\n+++ b/api/routes/books.py\n@@ -37,7 +37,7 @@ class SearchResult:\n \n @books_endpoint.route(\"/v1/books/search\", methods=[\"GET\"])\n @auth_required()\n-@cache.cached(query_string=True, key_prefix=lambda: f\"view/{get_current_user_id()}/{request.path}\")\n+@cache.cached(query_string=True, key_prefix=lambda: f\"view/{get_current_user_id()}/{request.full_path}\")\n def search_books():\n     search_term = request.args.get('q', '')\n     if not search_term:\ndiff --git a/postmortem.md b/postmortem.md\nnew file mode 100644\nindex 0000000..cb6483a\n--- /dev/null\n+++ b/postmortem.md\n@@ -0,0 +1,25 @@\n+# Postmortem: EdgeClientRequestJitter & BooklogrApiLatencyP99High\n+\n+## Incident Summary\n+On 2026-07-25, alerts `EdgeClientRequestJitter` and `BooklogrApiLatencyP99High` fired. The edge client traffic generator experienced request jitter, and `booklogr-api` p99 HTTP latency reached 2.485s (exceeding the 300ms threshold).\n+\n+## Root Cause Analysis\n+In `api/routes/books.py`, the `/v1/books/search` endpoint was decorated with:\n+```python\n+@cache.cached(query_string=True, key_prefix=lambda: f\"view/{get_current_user_id()}/{request.path}\")\n+```\n+In Flask-Caching, when `key_prefix` is passed a callable, the return value of the callable is used directly as the cache key, and `query_string=True` does not append query parameters. Because `request.path` evaluates to static `\"/v1/books/search\"`, all search requests for a user produced the exact same cache key (`view/1//v1/books/search`).\n+\n+Consequently, different search queries collided on the same cache key or bypassed expected caching behavior. When cache misses occurred, requests executed `BookProvider().search()`, making synchronous HTTP calls to OpenLibrary (`https://openlibrary.org/search.json`), which took ~1.35s per request. This blocked Gunicorn worker processes and caused latency spikes and request jitter.\n+\n+## Evidence Used\n+- Alertmanager active alerts showing `BooklogrApiLatencyP99High` (2.485s latency) and `EdgeClientRequestJitter`.\n+- Prometheus metrics showing `flask_http_request_duration_seconds_bucket` for `/v1/books/search` averaging 1.35s across requests.\n+- Git commit history showing commit `8c580a7d5978fbd6d87a9cf12f16653a39aa2d94` (\"Scope search cache key to the authenticated user\") which introduced `request.path` in the `key_prefix` lambda.\n+\n+## Fix Applied\n+Updated `api/routes/books.py` to use `request.full_path` in `key_prefix`:\n+```python\n+@cache.cached(query_string=True, key_prefix=lambda: f\"view/{get_current_user_id()}/{request.full_path}\")\n+```\n+This ensures that the cache key includes both the user ID and the specific query parameters (e.g. `view/1//v1/books/search?q=term`), providing proper per-user and per-query caching.\n",
  "finished_at": "2026-07-25T17:33:47.859Z",
  "full_record_sha256": "2d62834fb68789b21ee7421bf686bf7ec7670881cd4bc208756abcd1de81926f",
  "kind": "run-record",
  "profile": "incident",
  "record_version": "1.0.0",
  "run_id": "run-1784999648068",
  "scenario_id": "decoy-deploy-control",
  "score": {
    "oracle_id": "mitigation",
    "passed": false,
    "score": 0.35,
    "signals": [
      {
        "detail": "CI build + existing tests passed",
        "id": "ci_green",
        "satisfied": true,
        "value": 1,
        "weight": 0.25
      },
      {
        "detail": "alert BooklogrApiLatencyP99High cleared within budget",
        "id": "alert_cleared",
        "satisfied": false,
        "value": 0,
        "weight": 0.35
      },
      {
        "detail": "alert stayed cleared for 360s",
        "id": "sustained_clear",
        "satisfied": false,
        "value": 0,
        "weight": 0.2
      },
      {
        "detail": "did not clear",
        "id": "time_to_clear",
        "satisfied": false,
        "value": 0,
        "weight": 0.1
      },
      {
        "detail": "no regression alerts",
        "id": "no_new_alerts",
        "satisfied": true,
        "value": 1,
        "weight": 0.1
      }
    ]
  },
  "started_at": "2026-07-25T17:21:59.940Z",
  "timings": {
    "ci": 60966,
    "context": 0,
    "merge": 393,
    "redeploy": 43301,
    "run": 2682,
    "trigger": 38,
    "verify": 600539
  },
  "trajectory": {
    "agent_name": "external",
    "diff": "diff --git a/api/routes/books.py b/api/routes/books.py\nindex 2f26c2a..d8c071b 100644\n--- a/api/routes/books.py\n+++ b/api/routes/books.py\n@@ -37,7 +37,7 @@ class SearchResult:\n \n @books_endpoint.route(\"/v1/books/search\", methods=[\"GET\"])\n @auth_required()\n-@cache.cached(query_string=True, key_prefix=lambda: f\"view/{get_current_user_id()}/{request.path}\")\n+@cache.cached(query_string=True, key_prefix=lambda: f\"view/{get_current_user_id()}/{request.full_path}\")\n def search_books():\n     search_term = request.args.get('q', '')\n     if not search_term:\ndiff --git a/postmortem.md b/postmortem.md\nnew file mode 100644\nindex 0000000..cb6483a\n--- /dev/null\n+++ b/postmortem.md\n@@ -0,0 +1,25 @@\n+# Postmortem: EdgeClientRequestJitter & BooklogrApiLatencyP99High\n+\n+## Incident Summary\n+On 2026-07-25, alerts `EdgeClientRequestJitter` and `BooklogrApiLatencyP99High` fired. The edge client traffic generator experienced request jitter, and `booklogr-api` p99 HTTP latency reached 2.485s (exceeding the 300ms threshold).\n+\n+## Root Cause Analysis\n+In `api/routes/books.py`, the `/v1/books/search` endpoint was decorated with:\n+```python\n+@cache.cached(query_string=True, key_prefix=lambda: f\"view/{get_current_user_id()}/{request.path}\")\n+```\n+In Flask-Caching, when `key_prefix` is passed a callable, the return value of the callable is used directly as the cache key, and `query_string=True` does not append query parameters. Because `request.path` evaluates to static `\"/v1/books/search\"`, all search requests for a user produced the exact same cache key (`view/1//v1/books/search`).\n+\n+Consequently, different search queries collided on the same cache key or bypassed expected caching behavior. When cache misses occurred, requests executed `BookProvider().search()`, making synchronous HTTP calls to OpenLibrary (`https://openlibrary.org/search.json`), which took ~1.35s per request. This blocked Gunicorn worker processes and caused latency spikes and request jitter.\n+\n+## Evidence Used\n+- Alertmanager active alerts showing `BooklogrApiLatencyP99High` (2.485s latency) and `EdgeClientRequestJitter`.\n+- Prometheus metrics showing `flask_http_request_duration_seconds_bucket` for `/v1/books/search` averaging 1.35s across requests.\n+- Git commit history showing commit `8c580a7d5978fbd6d87a9cf12f16653a39aa2d94` (\"Scope search cache key to the authenticated user\") which introduced `request.path` in the `key_prefix` lambda.\n+\n+## Fix Applied\n+Updated `api/routes/books.py` to use `request.full_path` in `key_prefix`:\n+```python\n+@cache.cached(query_string=True, key_prefix=lambda: f\"view/{get_current_user_id()}/{request.full_path}\")\n+```\n+This ensures that the cache key includes both the user ID and the specific query parameters (e.g. `view/1//v1/books/search?q=term`), providing proper per-user and per-query caching.\n",
    "duration_ms": 2682,
    "submitted": true
  },
  "trigger": {
    "alert_name": "BooklogrApiLatencyP99High",
    "annotations": {
      "description": "p99 HTTP request latency is 2.484s (threshold 300ms) for the booklogr-api service.",
      "summary": "High p99 request latency on booklogr-api"
    },
    "fired_at": "2026-07-25T17:15:11.403162381Z",
    "labels": {
      "alertname": "BooklogrApiLatencyP99High",
      "service": "booklogr-api",
      "severity": "critical"
    },
    "severity": "critical",
    "source": "prometheus-alert"
  },
  "verdict": "failed"
}
