{
  "agent_transcript": {
    "captured_at": "2026-07-25T18:15:43.147Z",
    "harness": "agy",
    "model": "Gemini 3.6 Flash (High)",
    "provider": "antigravity",
    "run_id": "run-1785002808171",
    "schema_version": "agent-transcript.v1",
    "session": "cold",
    "submitted": true
  },
  "ci": {
    "duration_ms": 60953,
    "green": true,
    "output": "CI success for e25884f8 (http://localhost:3000/booklogr/booklogr/actions/runs/572)"
  },
  "deploy": {
    "duration_ms": 42952,
    "redeployed": true,
    "service": "booklogr-api"
  },
  "diff": "diff --git a/api/config.py b/api/config.py\nindex 81bf3a4..67f10ac 100644\n--- a/api/config.py\n+++ b/api/config.py\n@@ -13,7 +13,7 @@ class Config:\n     GOOGLE_CLIENT_SECRET = os.environ.get(\"GOOGLE_CLIENT_SECRET\", None)\n     SINGLE_USER_MODE = os.environ.get(\"SINGLE_USER_MODE\", \"False\")\n     AUTH_REQUIRE_VERIFICATION = os.environ.get(\"AUTH_REQUIRE_VERIFICATION\", \"False\")\n-    DATA_PROVIDER = os.environ.get(\"DATA_PROVIDER\", \"openlibrary\")\n+    DATA_PROVIDER = os.environ.get(\"DATA_PROVIDER\", \"http://book-metadata:8080\")\n     DATA_PROVIDER_FALLBACK = os.environ.get(\"DATA_PROVIDER_FALLBACK\", \"https://metadata.booklogr.app\")\n     \n     MAIL_SERVER = os.environ.get(\"MAIL_SERVER\", None)\ndiff --git a/postmortem.md b/postmortem.md\nnew file mode 100644\nindex 0000000..5f8365a\n--- /dev/null\n+++ b/postmortem.md\n@@ -0,0 +1,12 @@\n+# Incident Postmortem: High p99 Request Latency on booklogr-api\n+\n+## Root Cause\n+The `DATA_PROVIDER` configuration setting in `api/config.py` defaulted to `\"openlibrary\"`. When performing book searches on `/v1/books/search`, `BookProvider` attempted primary lookups against the external OpenLibrary endpoint (`https://openlibrary.org/search.json`). Because the service runs in an environment without external internet connectivity, these requests timed out (or took ~2.5s) on every call before falling back to the local metadata provider. This resulted in p99 HTTP latency > 2.4s and triggered the `BooklogrApiLatencyP99High` and `EdgeClientRequestJitter` alerts.\n+\n+## Evidence\n+- Prometheus `BooklogrApiLatencyP99High` alert showing p99 HTTP latency of ~2.48s (threshold 300ms) on `booklogr-api`.\n+- Prometheus target list and `BookMetadataTrafficStalled` alert rules identifying `http://book-metadata:8080` as the local metadata provider.\n+- Direct connectivity check showing external requests to `https://openlibrary.org` timed out, while requests to `http://book-metadata:8080/v1/search/...` succeeded instantly (<10ms).\n+\n+## Changes Made\n+Updated `api/config.py` to set the default `DATA_PROVIDER` to `\"http://book-metadata:8080\"`, directing primary search queries to the local metadata service.\n",
  "finished_at": "2026-07-25T18:27:31.336Z",
  "full_record_sha256": "9089479f3a2530888a8189c754016ca349a582aa7bbe3970a320f374b4f108af",
  "kind": "run-record",
  "profile": "incident",
  "record_version": "1.0.0",
  "run_id": "run-1785002808171",
  "scenario_id": "decoy-deploy-control",
  "score": {
    "oracle_id": "mitigation",
    "passed": false,
    "score": 0.35,
    "signals": [
      {
        "detail": "CI build + existing tests passed",
        "id": "ci_green",
        "satisfied": true,
        "value": 1,
        "weight": 0.25
      },
      {
        "detail": "alert BooklogrApiLatencyP99High cleared within budget",
        "id": "alert_cleared",
        "satisfied": false,
        "value": 0,
        "weight": 0.35
      },
      {
        "detail": "alert stayed cleared for 360s",
        "id": "sustained_clear",
        "satisfied": false,
        "value": 0,
        "weight": 0.2
      },
      {
        "detail": "did not clear",
        "id": "time_to_clear",
        "satisfied": false,
        "value": 0,
        "weight": 0.1
      },
      {
        "detail": "no regression alerts",
        "id": "no_new_alerts",
        "satisfied": true,
        "value": 1,
        "weight": 0.1
      }
    ]
  },
  "started_at": "2026-07-25T18:15:43.811Z",
  "timings": {
    "ci": 60953,
    "context": 0,
    "merge": 381,
    "redeploy": 42952,
    "run": 2682,
    "trigger": 33,
    "verify": 600524
  },
  "trajectory": {
    "agent_name": "external",
    "diff": "diff --git a/api/config.py b/api/config.py\nindex 81bf3a4..67f10ac 100644\n--- a/api/config.py\n+++ b/api/config.py\n@@ -13,7 +13,7 @@ class Config:\n     GOOGLE_CLIENT_SECRET = os.environ.get(\"GOOGLE_CLIENT_SECRET\", None)\n     SINGLE_USER_MODE = os.environ.get(\"SINGLE_USER_MODE\", \"False\")\n     AUTH_REQUIRE_VERIFICATION = os.environ.get(\"AUTH_REQUIRE_VERIFICATION\", \"False\")\n-    DATA_PROVIDER = os.environ.get(\"DATA_PROVIDER\", \"openlibrary\")\n+    DATA_PROVIDER = os.environ.get(\"DATA_PROVIDER\", \"http://book-metadata:8080\")\n     DATA_PROVIDER_FALLBACK = os.environ.get(\"DATA_PROVIDER_FALLBACK\", \"https://metadata.booklogr.app\")\n     \n     MAIL_SERVER = os.environ.get(\"MAIL_SERVER\", None)\ndiff --git a/postmortem.md b/postmortem.md\nnew file mode 100644\nindex 0000000..5f8365a\n--- /dev/null\n+++ b/postmortem.md\n@@ -0,0 +1,12 @@\n+# Incident Postmortem: High p99 Request Latency on booklogr-api\n+\n+## Root Cause\n+The `DATA_PROVIDER` configuration setting in `api/config.py` defaulted to `\"openlibrary\"`. When performing book searches on `/v1/books/search`, `BookProvider` attempted primary lookups against the external OpenLibrary endpoint (`https://openlibrary.org/search.json`). Because the service runs in an environment without external internet connectivity, these requests timed out (or took ~2.5s) on every call before falling back to the local metadata provider. This resulted in p99 HTTP latency > 2.4s and triggered the `BooklogrApiLatencyP99High` and `EdgeClientRequestJitter` alerts.\n+\n+## Evidence\n+- Prometheus `BooklogrApiLatencyP99High` alert showing p99 HTTP latency of ~2.48s (threshold 300ms) on `booklogr-api`.\n+- Prometheus target list and `BookMetadataTrafficStalled` alert rules identifying `http://book-metadata:8080` as the local metadata provider.\n+- Direct connectivity check showing external requests to `https://openlibrary.org` timed out, while requests to `http://book-metadata:8080/v1/search/...` succeeded instantly (<10ms).\n+\n+## Changes Made\n+Updated `api/config.py` to set the default `DATA_PROVIDER` to `\"http://book-metadata:8080\"`, directing primary search queries to the local metadata service.\n",
    "duration_ms": 2681,
    "submitted": true
  },
  "trigger": {
    "alert_name": "BooklogrApiLatencyP99High",
    "annotations": {
      "description": "p99 HTTP request latency is 2.484s (threshold 300ms) for the booklogr-api service.",
      "summary": "High p99 request latency on booklogr-api"
    },
    "fired_at": "2026-07-25T18:07:46.403162381Z",
    "labels": {
      "alertname": "BooklogrApiLatencyP99High",
      "service": "booklogr-api",
      "severity": "critical"
    },
    "severity": "critical",
    "source": "prometheus-alert"
  },
  "verdict": "failed"
}
