{
  "agent_transcript": {
    "captured_at": "2026-07-22T16:25:05.032Z",
    "harness": "agy",
    "model": "Gemini 3.6 Flash (High)",
    "provider": "antigravity",
    "run_id": "campaign-dbpool-2",
    "schema_version": "agent-transcript.v1",
    "session": "cold",
    "submitted": true
  },
  "ci": {
    "duration_ms": 65969,
    "green": true,
    "output": "CI success for dd235844 (http://localhost:3000/booklogr/booklogr/actions/runs/474)"
  },
  "deploy": {
    "duration_ms": 20318,
    "redeployed": true,
    "service": "booklogr-api"
  },
  "diff": "diff --git a/api/config.py b/api/config.py\nindex e64e23a..3565754 100644\n--- a/api/config.py\n+++ b/api/config.py\n@@ -25,7 +25,6 @@ class Config:\n \n     CACHE_TYPE = \"SimpleCache\"\n     CACHE_DEFAULT_TIMEOUT = 300\n-    SQLALCHEMY_ENGINE_OPTIONS = {\"pool_size\": 1, \"max_overflow\": 0, \"pool_timeout\": 5}\n \n     BASE_DIR = os.path.abspath(os.path.join(os.path.dirname(__file__), \"..\"))\n     ALLOWED_EXTENSIONS = {\"csv\"}\ndiff --git a/gunicorn.conf.py b/gunicorn.conf.py\nindex ed039b8..02456db 100644\n--- a/gunicorn.conf.py\n+++ b/gunicorn.conf.py\n@@ -2,13 +2,6 @@\n # multi-worker deployment exposes one aggregated /metrics endpoint.\n from prometheus_flask_exporter.multiprocess import GunicornPrometheusMetrics\n \n-# Threaded workers: each of gunicorn's -w processes now accepts up to\n-# `threads` requests concurrently instead of one at a time. Bumped as part of\n-# the same tuning pass that reduced the DB pool footprint below, to squeeze\n-# more throughput out of fewer connections.\n-worker_class = \"gthread\"\n-threads = 8\n-\n \n def when_ready(server):\n     # Serve aggregated metrics from the gunicorn master on a dedicated port,\ndiff --git a/postmortem.md b/postmortem.md\nnew file mode 100644\nindex 0000000..15f53cd\n--- /dev/null\n+++ b/postmortem.md\n@@ -0,0 +1,20 @@\n+# Incident Postmortem: Edge Client Request Jitter & High p99 Latency on booklogr-api\n+\n+## Summary\n+On 2026-07-22, the `BooklogrApiLatencyP99High` critical alert and `EdgeClientRequestJitter` warning alert fired for the `booklogr-api` service. The p99 HTTP request latency spiked to ~750-900ms, exceeding the 300ms threshold.\n+\n+## Root Cause\n+Commit `8c2a1e1b7aa0a4a842feb909e2f17f298de8cf4f` (\"Reduce DB connection footprint\") introduced:\n+1. `worker_class = \"gthread\"` and `threads = 8` in `gunicorn.conf.py`.\n+2. `SQLALCHEMY_ENGINE_OPTIONS = {\"pool_size\": 1, \"max_overflow\": 0, \"pool_timeout\": 5}` in `api/config.py`.\n+\n+With 8 request worker threads per Gunicorn process but only 1 database connection in the SQLAlchemy connection pool (and 0 overflow allowed), concurrent HTTP requests within the same worker process were forced to block and queue sequentially waiting for access to the single DB connection. This pool contention caused latency jitter and elevated p99 response times.\n+\n+## Evidence Used\n+- **Alertmanager / Prometheus**: Active alerts `BooklogrApiLatencyP99High` (p99 latency ~750-900ms) and `EdgeClientRequestJitter`.\n+- **Git Commit History**: `git log -p -n 2` identified commit `8c2a1e1b` as recent tuning change right before alert timestamps.\n+- **Code Audit**: Confirmed thread contention bottleneck where 8 worker threads competed for `pool_size: 1` in `api/config.py`.\n+\n+## Corrective Action / Fix\n+- Removed `SQLALCHEMY_ENGINE_OPTIONS = {\"pool_size\": 1, \"max_overflow\": 0, \"pool_timeout\": 5}` from `api/config.py`.\n+- Removed `worker_class = \"gthread\"` and `threads = 8` from `gunicorn.conf.py`.\n",
  "finished_at": "2026-07-22T16:33:00.378Z",
  "full_record_sha256": "6f728567bf879071ffb7108dfd50faf4cb53db3344de9bd8e7d0a9612b3cc17a",
  "kind": "run-record",
  "profile": "incident",
  "record_version": "1.0.0",
  "run_id": "campaign-dbpool-2",
  "scenario_id": "db-pool-exhaustion-deploy",
  "score": {
    "oracle_id": "mitigation",
    "passed": true,
    "score": 0.9958293333333333,
    "signals": [
      {
        "detail": "CI build + existing tests passed",
        "id": "ci_green",
        "satisfied": true,
        "value": 1,
        "weight": 0.25
      },
      {
        "detail": "alert BooklogrApiLatencyP99High cleared within budget",
        "id": "alert_cleared",
        "satisfied": true,
        "value": 1,
        "weight": 0.35
      },
      {
        "detail": "alert stayed cleared for 360s",
        "id": "sustained_clear",
        "satisfied": true,
        "value": 1,
        "weight": 0.2
      },
      {
        "detail": "cleared in 25s",
        "id": "time_to_clear",
        "satisfied": true,
        "value": 0.9582933333333333,
        "weight": 0.1
      },
      {
        "detail": "no regression alerts",
        "id": "no_new_alerts",
        "satisfied": true,
        "value": 1,
        "weight": 0.1
      }
    ]
  },
  "started_at": "2026-07-22T16:25:05.692Z",
  "timings": {
    "ci": 65969,
    "context": 0,
    "merge": 384,
    "redeploy": 20318,
    "run": 2653,
    "trigger": 38,
    "verify": 385324
  },
  "trajectory": {
    "agent_name": "external",
    "diff": "diff --git a/api/config.py b/api/config.py\nindex e64e23a..3565754 100644\n--- a/api/config.py\n+++ b/api/config.py\n@@ -25,7 +25,6 @@ class Config:\n \n     CACHE_TYPE = \"SimpleCache\"\n     CACHE_DEFAULT_TIMEOUT = 300\n-    SQLALCHEMY_ENGINE_OPTIONS = {\"pool_size\": 1, \"max_overflow\": 0, \"pool_timeout\": 5}\n \n     BASE_DIR = os.path.abspath(os.path.join(os.path.dirname(__file__), \"..\"))\n     ALLOWED_EXTENSIONS = {\"csv\"}\ndiff --git a/gunicorn.conf.py b/gunicorn.conf.py\nindex ed039b8..02456db 100644\n--- a/gunicorn.conf.py\n+++ b/gunicorn.conf.py\n@@ -2,13 +2,6 @@\n # multi-worker deployment exposes one aggregated /metrics endpoint.\n from prometheus_flask_exporter.multiprocess import GunicornPrometheusMetrics\n \n-# Threaded workers: each of gunicorn's -w processes now accepts up to\n-# `threads` requests concurrently instead of one at a time. Bumped as part of\n-# the same tuning pass that reduced the DB pool footprint below, to squeeze\n-# more throughput out of fewer connections.\n-worker_class = \"gthread\"\n-threads = 8\n-\n \n def when_ready(server):\n     # Serve aggregated metrics from the gunicorn master on a dedicated port,\ndiff --git a/postmortem.md b/postmortem.md\nnew file mode 100644\nindex 0000000..15f53cd\n--- /dev/null\n+++ b/postmortem.md\n@@ -0,0 +1,20 @@\n+# Incident Postmortem: Edge Client Request Jitter & High p99 Latency on booklogr-api\n+\n+## Summary\n+On 2026-07-22, the `BooklogrApiLatencyP99High` critical alert and `EdgeClientRequestJitter` warning alert fired for the `booklogr-api` service. The p99 HTTP request latency spiked to ~750-900ms, exceeding the 300ms threshold.\n+\n+## Root Cause\n+Commit `8c2a1e1b7aa0a4a842feb909e2f17f298de8cf4f` (\"Reduce DB connection footprint\") introduced:\n+1. `worker_class = \"gthread\"` and `threads = 8` in `gunicorn.conf.py`.\n+2. `SQLALCHEMY_ENGINE_OPTIONS = {\"pool_size\": 1, \"max_overflow\": 0, \"pool_timeout\": 5}` in `api/config.py`.\n+\n+With 8 request worker threads per Gunicorn process but only 1 database connection in the SQLAlchemy connection pool (and 0 overflow allowed), concurrent HTTP requests within the same worker process were forced to block and queue sequentially waiting for access to the single DB connection. This pool contention caused latency jitter and elevated p99 response times.\n+\n+## Evidence Used\n+- **Alertmanager / Prometheus**: Active alerts `BooklogrApiLatencyP99High` (p99 latency ~750-900ms) and `EdgeClientRequestJitter`.\n+- **Git Commit History**: `git log -p -n 2` identified commit `8c2a1e1b` as recent tuning change right before alert timestamps.\n+- **Code Audit**: Confirmed thread contention bottleneck where 8 worker threads competed for `pool_size: 1` in `api/config.py`.\n+\n+## Corrective Action / Fix\n+- Removed `SQLALCHEMY_ENGINE_OPTIONS = {\"pool_size\": 1, \"max_overflow\": 0, \"pool_timeout\": 5}` from `api/config.py`.\n+- Removed `worker_class = \"gthread\"` and `threads = 8` from `gunicorn.conf.py`.\n",
    "duration_ms": 2653,
    "submitted": true
  },
  "trigger": {
    "alert_name": "BooklogrApiLatencyP99High",
    "annotations": {
      "description": "p99 HTTP request latency is 748.5ms (threshold 300ms) for the booklogr-api service.",
      "summary": "High p99 request latency on booklogr-api"
    },
    "fired_at": "2026-07-22T16:19:41.403162381Z",
    "labels": {
      "alertname": "BooklogrApiLatencyP99High",
      "service": "booklogr-api",
      "severity": "critical"
    },
    "severity": "critical",
    "source": "prometheus-alert"
  },
  "verdict": "passed"
}
