{
  "agent_transcript": {
    "captured_at": "2026-07-22T14:58:11.316Z",
    "harness": "agy",
    "model": "Gemini 3.6 Flash (High)",
    "provider": "antigravity",
    "run_id": "campaign-redherring-1",
    "schema_version": "agent-transcript.v1",
    "session": "cold",
    "submitted": true
  },
  "ci": {
    "duration_ms": 65880,
    "green": true,
    "output": "CI success for 3f4f036e (http://localhost:3000/booklogr/booklogr/actions/runs/452)"
  },
  "deploy": {
    "duration_ms": 42108,
    "redeployed": true,
    "service": "booklogr-api"
  },
  "diff": "diff --git a/api/config.py b/api/config.py\nindex 6484285..81bf3a4 100644\n--- a/api/config.py\n+++ b/api/config.py\n@@ -23,7 +23,7 @@ class Config:\n     MAIL_PASSWORD = os.environ.get(\"MAIL_PASSWORD\", None)\n     MAIL_DEFAULT_SENDER = os.environ.get(\"MAIL_SENDER\", os.environ.get(\"MAIL_USERNAME\"))\n \n-    CACHE_TYPE = \"NullCache\"\n+    CACHE_TYPE = os.environ.get(\"CACHE_TYPE\", \"SimpleCache\")\n     CACHE_DEFAULT_TIMEOUT = 300\n \n     BASE_DIR = os.path.abspath(os.path.join(os.path.dirname(__file__), \"..\"))\ndiff --git a/postmortem.md b/postmortem.md\nnew file mode 100644\nindex 0000000..767624e\n--- /dev/null\n+++ b/postmortem.md\n@@ -0,0 +1,18 @@\n+# Incident Postmortem: Edge Client Request Jitter & High API Latency\n+\n+## Root Cause\n+Commit `f1276612dfa530d4f49189c352014d3706ce7e24` (\"Disable response caching\") changed `CACHE_TYPE` in `api/config.py` from `\"SimpleCache\"` to `\"NullCache\"`. \n+Disabling response caching caused every request to `/v1/books/search` (which relies on `@cache.cached`) to perform a live, synchronous external metadata query via `BookProvider`. Under traffic generator load, the uncached requests overloaded the upstream metadata service (causing 503 errors) and exhausted Gunicorn worker processes. This caused P99 request latency on `booklogr-api` to spike to ~2.5s (threshold 300ms) and resulted in flapping request jitter on the edge client.\n+\n+## Evidence Used\n+- **Alertmanager & Prometheus Signals**:\n+  - `EdgeClientRequestJitter`: Flapping request jitter on edge client traffic.\n+  - `BooklogrApiLatencyP99High`: P99 latency on `booklogr-api` reached 2.484s.\n+  - `BookMetadataProviderErrorsElevated`: `book-metadata` provider returned elevated 5xx responses due to uncached query spikes.\n+- **Prometheus Metric Inspection**:\n+  - `flask_http_request_duration_seconds_bucket{path=\"/v1/books/search\"}` showed the vast majority of search requests taking between 0.25s and 2.5s.\n+- **Git History**:\n+  - `git log -p -n 10` revealed commit `f127661` which changed `CACHE_TYPE = \"NullCache\"`.\n+\n+## Changes Made\n+- Modified `api/config.py` to restore response caching using `CACHE_TYPE = os.environ.get(\"CACHE_TYPE\", \"SimpleCache\")`.\n",
  "finished_at": "2026-07-22T15:06:28.440Z",
  "full_record_sha256": "7e07cffa104e355858ade83b87b0cacdf27599e05e4c53a5385d84c47623e37e",
  "kind": "run-record",
  "profile": "incident",
  "record_version": "1.0.0",
  "run_id": "campaign-redherring-1",
  "scenario_id": "red-herring-coalert",
  "score": {
    "oracle_id": "mitigation",
    "passed": true,
    "score": 0.9958291666666667,
    "signals": [
      {
        "detail": "CI build + existing tests passed",
        "id": "ci_green",
        "satisfied": true,
        "value": 1,
        "weight": 0.25
      },
      {
        "detail": "alert BooklogrApiLatencyP99High cleared within budget",
        "id": "alert_cleared",
        "satisfied": true,
        "value": 1,
        "weight": 0.35
      },
      {
        "detail": "alert stayed cleared for 360s",
        "id": "sustained_clear",
        "satisfied": true,
        "value": 1,
        "weight": 0.2
      },
      {
        "detail": "cleared in 25s",
        "id": "time_to_clear",
        "satisfied": true,
        "value": 0.9582916666666667,
        "weight": 0.1
      },
      {
        "detail": "no regression alerts",
        "id": "no_new_alerts",
        "satisfied": true,
        "value": 1,
        "weight": 0.1
      }
    ]
  },
  "started_at": "2026-07-22T14:58:12.003Z",
  "timings": {
    "ci": 65880,
    "context": 0,
    "merge": 383,
    "redeploy": 42108,
    "run": 2692,
    "trigger": 35,
    "verify": 385338
  },
  "trajectory": {
    "agent_name": "external",
    "diff": "diff --git a/api/config.py b/api/config.py\nindex 6484285..81bf3a4 100644\n--- a/api/config.py\n+++ b/api/config.py\n@@ -23,7 +23,7 @@ class Config:\n     MAIL_PASSWORD = os.environ.get(\"MAIL_PASSWORD\", None)\n     MAIL_DEFAULT_SENDER = os.environ.get(\"MAIL_SENDER\", os.environ.get(\"MAIL_USERNAME\"))\n \n-    CACHE_TYPE = \"NullCache\"\n+    CACHE_TYPE = os.environ.get(\"CACHE_TYPE\", \"SimpleCache\")\n     CACHE_DEFAULT_TIMEOUT = 300\n \n     BASE_DIR = os.path.abspath(os.path.join(os.path.dirname(__file__), \"..\"))\ndiff --git a/postmortem.md b/postmortem.md\nnew file mode 100644\nindex 0000000..767624e\n--- /dev/null\n+++ b/postmortem.md\n@@ -0,0 +1,18 @@\n+# Incident Postmortem: Edge Client Request Jitter & High API Latency\n+\n+## Root Cause\n+Commit `f1276612dfa530d4f49189c352014d3706ce7e24` (\"Disable response caching\") changed `CACHE_TYPE` in `api/config.py` from `\"SimpleCache\"` to `\"NullCache\"`. \n+Disabling response caching caused every request to `/v1/books/search` (which relies on `@cache.cached`) to perform a live, synchronous external metadata query via `BookProvider`. Under traffic generator load, the uncached requests overloaded the upstream metadata service (causing 503 errors) and exhausted Gunicorn worker processes. This caused P99 request latency on `booklogr-api` to spike to ~2.5s (threshold 300ms) and resulted in flapping request jitter on the edge client.\n+\n+## Evidence Used\n+- **Alertmanager & Prometheus Signals**:\n+  - `EdgeClientRequestJitter`: Flapping request jitter on edge client traffic.\n+  - `BooklogrApiLatencyP99High`: P99 latency on `booklogr-api` reached 2.484s.\n+  - `BookMetadataProviderErrorsElevated`: `book-metadata` provider returned elevated 5xx responses due to uncached query spikes.\n+- **Prometheus Metric Inspection**:\n+  - `flask_http_request_duration_seconds_bucket{path=\"/v1/books/search\"}` showed the vast majority of search requests taking between 0.25s and 2.5s.\n+- **Git History**:\n+  - `git log -p -n 10` revealed commit `f127661` which changed `CACHE_TYPE = \"NullCache\"`.\n+\n+## Changes Made\n+- Modified `api/config.py` to restore response caching using `CACHE_TYPE = os.environ.get(\"CACHE_TYPE\", \"SimpleCache\")`.\n",
    "duration_ms": 2692,
    "submitted": true
  },
  "trigger": {
    "alert_name": "BooklogrApiLatencyP99High",
    "annotations": {
      "description": "p99 HTTP request latency is 2.484s (threshold 300ms) for the booklogr-api service.",
      "summary": "High p99 request latency on booklogr-api"
    },
    "fired_at": "2026-07-22T14:48:21.403162381Z",
    "labels": {
      "alertname": "BooklogrApiLatencyP99High",
      "service": "booklogr-api",
      "severity": "critical"
    },
    "severity": "critical",
    "source": "prometheus-alert"
  },
  "verdict": "passed"
}
