{
  "agent_transcript": {
    "captured_at": "2026-07-21T03:51:24.571Z",
    "harness": "agy",
    "model": "Gemini 3.1 Pro (High)",
    "provider": "antigravity",
    "run_id": "headroom-decoy-1",
    "schema_version": "agent-transcript.v1",
    "session": "cold",
    "submitted": true
  },
  "ci": {
    "duration_ms": 60737,
    "green": true,
    "output": "CI success for 1de0a561 (http://localhost:3000/booklogr/booklogr/actions/runs/189)"
  },
  "deploy": {
    "duration_ms": 46002,
    "redeployed": true,
    "service": "booklogr-api"
  },
  "diff": "diff --git a/api/config.py b/api/config.py\nindex 81bf3a4..2cfdd12 100644\n--- a/api/config.py\n+++ b/api/config.py\n@@ -23,7 +23,7 @@ class Config:\n     MAIL_PASSWORD = os.environ.get(\"MAIL_PASSWORD\", None)\n     MAIL_DEFAULT_SENDER = os.environ.get(\"MAIL_SENDER\", os.environ.get(\"MAIL_USERNAME\"))\n \n-    CACHE_TYPE = os.environ.get(\"CACHE_TYPE\", \"SimpleCache\")\n+    CACHE_TYPE = os.environ.get(\"CACHE_TYPE\") or \"SimpleCache\"\n     CACHE_DEFAULT_TIMEOUT = 300\n \n     BASE_DIR = os.path.abspath(os.path.join(os.path.dirname(__file__), \"..\"))\ndiff --git a/api/routes/books.py b/api/routes/books.py\nindex 2f26c2a..d8c071b 100644\n--- a/api/routes/books.py\n+++ b/api/routes/books.py\n@@ -37,7 +37,7 @@ class SearchResult:\n \n @books_endpoint.route(\"/v1/books/search\", methods=[\"GET\"])\n @auth_required()\n-@cache.cached(query_string=True, key_prefix=lambda: f\"view/{get_current_user_id()}/{request.path}\")\n+@cache.cached(query_string=True, key_prefix=lambda: f\"view/{get_current_user_id()}/{request.full_path}\")\n def search_books():\n     search_term = request.args.get('q', '')\n     if not search_term:\ndiff --git a/postmortem.md b/postmortem.md\nnew file mode 100644\nindex 0000000..f1ffe04\n--- /dev/null\n+++ b/postmortem.md\n@@ -0,0 +1,14 @@\n+# Postmortem: High p99 Latency on booklogr-api\n+\n+## Root Cause\n+The `CACHE_TYPE` environment variable was incorrectly evaluating to an empty string when unset or defined empty in the environment, due to a recent change introducing `os.environ.get(\"CACHE_TYPE\", \"SimpleCache\")`. An empty string overrides the default parameter in `get()`, resulting in an invalid cache backend configuration (`\"\"` or `NullCache`). This effectively disabled caching for the `/v1/books/search` route, causing every request to synchronously hit the upstream provider (OpenLibrary), driving p99 latency up to ~1.6s. \n+Additionally, the cache key generation ignored the query string due to Flask-Caching ignoring `query_string=True` when `key_prefix` is a callable, which caused the cache key to remain identical across different search terms for the same user.\n+\n+## Evidence\n+- Prometheus metrics (`flask_http_request_duration_seconds_bucket`) on port 9090 indicated 695/702 requests to `/v1/books/search` were taking between 1.0 and 2.5 seconds, strongly correlating with OpenLibrary's external request latency.\n+- Code review of `api/config.py` in commit `6595caf` revealed the flawed environment variable fallback logic.\n+- Code review of `api/routes/books.py` revealed the flawed `key_prefix` lambda that only referenced `request.path`.\n+\n+## Fix\n+- Replaced `os.environ.get(\"CACHE_TYPE\", \"SimpleCache\")` with `os.environ.get(\"CACHE_TYPE\") or \"SimpleCache\"` in `api/config.py` so that empty string evaluations correctly fallback to `SimpleCache`.\n+- Replaced `request.path` with `request.full_path` in the `books.py` caching decorator to correctly partition the cache keys by query string.\n",
  "finished_at": "2026-07-21T03:56:15.152Z",
  "full_record_sha256": "0806c51109c9fbc05c9f3e9932d76133a3f42b64b06e7c92c440c36f9361c300",
  "kind": "run-record",
  "profile": "incident",
  "record_version": "1.0.0",
  "run_id": "headroom-decoy-1",
  "scenario_id": "decoy-deploy-control",
  "score": {
    "oracle_id": "mitigation",
    "passed": false,
    "score": 0.35,
    "signals": [
      {
        "detail": "CI build + existing tests passed",
        "id": "ci_green",
        "satisfied": true,
        "value": 1,
        "weight": 0.25
      },
      {
        "detail": "alert BooklogrApiLatencyP99High cleared within budget",
        "id": "alert_cleared",
        "satisfied": false,
        "value": 0,
        "weight": 0.35
      },
      {
        "detail": "alert stayed cleared for 30s",
        "id": "sustained_clear",
        "satisfied": false,
        "value": 0,
        "weight": 0.2
      },
      {
        "detail": "did not clear",
        "id": "time_to_clear",
        "satisfied": false,
        "value": 0,
        "weight": 0.1
      },
      {
        "detail": "no regression alerts",
        "id": "no_new_alerts",
        "satisfied": true,
        "value": 1,
        "weight": 0.1
      }
    ]
  },
  "started_at": "2026-07-21T03:51:25.202Z",
  "timings": {
    "ci": 60737,
    "context": 0,
    "merge": 373,
    "redeploy": 46002,
    "run": 2642,
    "trigger": 35,
    "verify": 180161
  },
  "trajectory": {
    "agent_name": "external",
    "diff": "diff --git a/api/config.py b/api/config.py\nindex 81bf3a4..2cfdd12 100644\n--- a/api/config.py\n+++ b/api/config.py\n@@ -23,7 +23,7 @@ class Config:\n     MAIL_PASSWORD = os.environ.get(\"MAIL_PASSWORD\", None)\n     MAIL_DEFAULT_SENDER = os.environ.get(\"MAIL_SENDER\", os.environ.get(\"MAIL_USERNAME\"))\n \n-    CACHE_TYPE = os.environ.get(\"CACHE_TYPE\", \"SimpleCache\")\n+    CACHE_TYPE = os.environ.get(\"CACHE_TYPE\") or \"SimpleCache\"\n     CACHE_DEFAULT_TIMEOUT = 300\n \n     BASE_DIR = os.path.abspath(os.path.join(os.path.dirname(__file__), \"..\"))\ndiff --git a/api/routes/books.py b/api/routes/books.py\nindex 2f26c2a..d8c071b 100644\n--- a/api/routes/books.py\n+++ b/api/routes/books.py\n@@ -37,7 +37,7 @@ class SearchResult:\n \n @books_endpoint.route(\"/v1/books/search\", methods=[\"GET\"])\n @auth_required()\n-@cache.cached(query_string=True, key_prefix=lambda: f\"view/{get_current_user_id()}/{request.path}\")\n+@cache.cached(query_string=True, key_prefix=lambda: f\"view/{get_current_user_id()}/{request.full_path}\")\n def search_books():\n     search_term = request.args.get('q', '')\n     if not search_term:\ndiff --git a/postmortem.md b/postmortem.md\nnew file mode 100644\nindex 0000000..f1ffe04\n--- /dev/null\n+++ b/postmortem.md\n@@ -0,0 +1,14 @@\n+# Postmortem: High p99 Latency on booklogr-api\n+\n+## Root Cause\n+The `CACHE_TYPE` environment variable was incorrectly evaluating to an empty string when unset or defined empty in the environment, due to a recent change introducing `os.environ.get(\"CACHE_TYPE\", \"SimpleCache\")`. An empty string overrides the default parameter in `get()`, resulting in an invalid cache backend configuration (`\"\"` or `NullCache`). This effectively disabled caching for the `/v1/books/search` route, causing every request to synchronously hit the upstream provider (OpenLibrary), driving p99 latency up to ~1.6s. \n+Additionally, the cache key generation ignored the query string due to Flask-Caching ignoring `query_string=True` when `key_prefix` is a callable, which caused the cache key to remain identical across different search terms for the same user.\n+\n+## Evidence\n+- Prometheus metrics (`flask_http_request_duration_seconds_bucket`) on port 9090 indicated 695/702 requests to `/v1/books/search` were taking between 1.0 and 2.5 seconds, strongly correlating with OpenLibrary's external request latency.\n+- Code review of `api/config.py` in commit `6595caf` revealed the flawed environment variable fallback logic.\n+- Code review of `api/routes/books.py` revealed the flawed `key_prefix` lambda that only referenced `request.path`.\n+\n+## Fix\n+- Replaced `os.environ.get(\"CACHE_TYPE\", \"SimpleCache\")` with `os.environ.get(\"CACHE_TYPE\") or \"SimpleCache\"` in `api/config.py` so that empty string evaluations correctly fallback to `SimpleCache`.\n+- Replaced `request.path` with `request.full_path` in the `books.py` caching decorator to correctly partition the cache keys by query string.\n",
    "duration_ms": 2642,
    "submitted": true
  },
  "trigger": {
    "alert_name": "BooklogrApiLatencyP99High",
    "annotations": {
      "description": "p99 HTTP request latency is 2.484s (threshold 300ms) for the booklogr-api service.",
      "summary": "High p99 request latency on booklogr-api"
    },
    "fired_at": "2026-07-21T03:38:11.403162381Z",
    "labels": {
      "alertname": "BooklogrApiLatencyP99High",
      "service": "booklogr-api",
      "severity": "critical"
    },
    "severity": "critical",
    "source": "prometheus-alert"
  },
  "verdict": "failed"
}
