{
  "ci": {
    "duration_ms": 60791,
    "green": true,
    "output": "CI success for f2ab5498 (http://localhost:3000/booklogr/booklogr/actions/runs/408)"
  },
  "deploy": {
    "duration_ms": 20514,
    "redeployed": true,
    "service": "booklogr-api"
  },
  "diff": "diff --git a/api/config.py b/api/config.py\nindex 6484285..3565754 100644\n--- a/api/config.py\n+++ b/api/config.py\n@@ -23,7 +23,7 @@ class Config:\n     MAIL_PASSWORD = os.environ.get(\"MAIL_PASSWORD\", None)\n     MAIL_DEFAULT_SENDER = os.environ.get(\"MAIL_SENDER\", os.environ.get(\"MAIL_USERNAME\"))\n \n-    CACHE_TYPE = \"NullCache\"\n+    CACHE_TYPE = \"SimpleCache\"\n     CACHE_DEFAULT_TIMEOUT = 300\n \n     BASE_DIR = os.path.abspath(os.path.join(os.path.dirname(__file__), \"..\"))\n",
  "finished_at": "2026-07-22T05:25:08.583Z",
  "full_record_sha256": "381b9763f8e6bd520e96594c24744db85e2a7bb0bc899a3904af376ae4950e2d",
  "kind": "run-record",
  "profile": "incident",
  "record_version": "1.0.0",
  "run_id": "poscontrol-stampede-360",
  "scenario_id": "latency-cache-stampede",
  "score": {
    "oracle_id": "mitigation",
    "passed": true,
    "score": 0.983315,
    "signals": [
      {
        "detail": "CI build + existing tests passed",
        "id": "ci_green",
        "satisfied": true,
        "value": 1,
        "weight": 0.25
      },
      {
        "detail": "alert BooklogrApiLatencyP99High cleared within budget",
        "id": "alert_cleared",
        "satisfied": true,
        "value": 1,
        "weight": 0.35
      },
      {
        "detail": "alert stayed cleared for 360s",
        "id": "sustained_clear",
        "satisfied": true,
        "value": 1,
        "weight": 0.2
      },
      {
        "detail": "cleared in 30s",
        "id": "time_to_clear",
        "satisfied": true,
        "value": 0.8331500000000001,
        "weight": 0.1
      },
      {
        "detail": "no regression alerts",
        "id": "no_new_alerts",
        "satisfied": true,
        "value": 1,
        "weight": 0.1
      }
    ]
  },
  "started_at": "2026-07-22T05:17:15.897Z",
  "timings": {
    "ci": 60791,
    "context": 0,
    "merge": 388,
    "redeploy": 20514,
    "run": 625,
    "trigger": 34,
    "verify": 390334
  },
  "trajectory": {
    "agent_name": "reference-fix",
    "diff": "diff --git a/api/config.py b/api/config.py\nindex 6484285..3565754 100644\n--- a/api/config.py\n+++ b/api/config.py\n@@ -23,7 +23,7 @@ class Config:\n     MAIL_PASSWORD = os.environ.get(\"MAIL_PASSWORD\", None)\n     MAIL_DEFAULT_SENDER = os.environ.get(\"MAIL_SENDER\", os.environ.get(\"MAIL_USERNAME\"))\n \n-    CACHE_TYPE = \"NullCache\"\n+    CACHE_TYPE = \"SimpleCache\"\n     CACHE_DEFAULT_TIMEOUT = 300\n \n     BASE_DIR = os.path.abspath(os.path.join(os.path.dirname(__file__), \"..\"))\n",
    "duration_ms": 625,
    "submitted": true
  },
  "trigger": {
    "alert_name": "BooklogrApiLatencyP99High",
    "annotations": {
      "description": "p99 HTTP request latency is 2.485s (threshold 300ms) for the booklogr-api service.",
      "summary": "High p99 request latency on booklogr-api"
    },
    "fired_at": "2026-07-22T05:16:41.403162381Z",
    "labels": {
      "alertname": "BooklogrApiLatencyP99High",
      "service": "booklogr-api",
      "severity": "critical"
    },
    "severity": "critical",
    "source": "prometheus-alert"
  },
  "verdict": "passed"
}
