{
  "agent_transcript": {
    "captured_at": "2026-07-22T13:05:21.568Z",
    "harness": "agy",
    "model": "Gemini 3.6 Flash (High)",
    "provider": "antigravity",
    "run_id": "campaign-latency-1",
    "schema_version": "agent-transcript.v1",
    "session": "cold",
    "submitted": true
  },
  "ci": {
    "duration_ms": 60817,
    "green": true,
    "output": "CI success for fc8563c3 (http://localhost:3000/booklogr/booklogr/actions/runs/424)"
  },
  "deploy": {
    "duration_ms": 20337,
    "redeployed": true,
    "service": "booklogr-api"
  },
  "diff": "diff --git a/api/config.py b/api/config.py\nindex 6484285..3565754 100644\n--- a/api/config.py\n+++ b/api/config.py\n@@ -23,7 +23,7 @@ class Config:\n     MAIL_PASSWORD = os.environ.get(\"MAIL_PASSWORD\", None)\n     MAIL_DEFAULT_SENDER = os.environ.get(\"MAIL_SENDER\", os.environ.get(\"MAIL_USERNAME\"))\n \n-    CACHE_TYPE = \"NullCache\"\n+    CACHE_TYPE = \"SimpleCache\"\n     CACHE_DEFAULT_TIMEOUT = 300\n \n     BASE_DIR = os.path.abspath(os.path.join(os.path.dirname(__file__), \"..\"))\ndiff --git a/postmortem.md b/postmortem.md\nnew file mode 100644\nindex 0000000..842ae0d\n--- /dev/null\n+++ b/postmortem.md\n@@ -0,0 +1,14 @@\n+# Incident Postmortem: EdgeClientRequestJitter & BooklogrApiLatencyP99High\n+\n+## Root Cause\n+In commit f1276612df15d0d449189c35201443746ce7e24 (\"Disable response caching\"), CACHE_TYPE in api/config.py was set to \"NullCache\" (disabling Flask response caching, which previously used \"SimpleCache\").\n+\n+When caching was disabled, every request to /v1/books/search triggered BookProvider().search(). The primary provider lookup attempted to query OpenLibrary (https://openlibrary.org), which was unreachable in this environment and timed out after 30 seconds. Because Gunicorn operates with 4 workers (-w 4), incoming search traffic from the edge client quickly exhausted all worker threads while waiting on 30-second socket timeouts. This worker thread starvation led to severe request queuing, high p99 latency (>2.4s), and flapping request jitter on edge-client.\n+\n+## Evidence Used\t\n+1. Alertmanager alert BooklogrApiLatencyP99High reporting p99 HTTP request latency of 2.485s (threshold 300ms) on booklogr-api.\n+2. Prometheus query metrics showing /v1/books/search averaging >1.2s per request due to repeated external metadata provider timeouts.\n+3. Git commit history showing commit f1276612df15d0d449189c35201443746ce7e24 which modified api/config.py from CACHE_TYPE = \"SimpleCache\" to CACHE_TYPE = \"NullCache\".\n+\n+## Key Changes Made\n+- Modified api/config.py to restore CACHE_TYPE = \"SimpleCache\", enabling Flask response caching for search results and alleviating worker thread starvation.\n",
  "finished_at": "2026-07-22T13:13:11.724Z",
  "full_record_sha256": "a2d8f16e7cc45f2c168ac06b546f36a21f1a6da2cd072a1cbb453579d73fac16",
  "kind": "run-record",
  "profile": "incident",
  "record_version": "1.0.0",
  "run_id": "campaign-latency-1",
  "scenario_id": "latency-cache-stampede",
  "score": {
    "oracle_id": "mitigation",
    "passed": true,
    "score": 0.9958293333333333,
    "signals": [
      {
        "detail": "CI build + existing tests passed",
        "id": "ci_green",
        "satisfied": true,
        "value": 1,
        "weight": 0.25
      },
      {
        "detail": "alert BooklogrApiLatencyP99High cleared within budget",
        "id": "alert_cleared",
        "satisfied": true,
        "value": 1,
        "weight": 0.35
      },
      {
        "detail": "alert stayed cleared for 360s",
        "id": "sustained_clear",
        "satisfied": true,
        "value": 1,
        "weight": 0.2
      },
      {
        "detail": "cleared in 25s",
        "id": "time_to_clear",
        "satisfied": true,
        "value": 0.9582933333333333,
        "weight": 0.1
      },
      {
        "detail": "no regression alerts",
        "id": "no_new_alerts",
        "satisfied": true,
        "value": 1,
        "weight": 0.1
      }
    ]
  },
  "started_at": "2026-07-22T13:05:22.210Z",
  "timings": {
    "ci": 60817,
    "context": 0,
    "merge": 373,
    "redeploy": 20337,
    "run": 2635,
    "trigger": 36,
    "verify": 385316
  },
  "trajectory": {
    "agent_name": "external",
    "diff": "diff --git a/api/config.py b/api/config.py\nindex 6484285..3565754 100644\n--- a/api/config.py\n+++ b/api/config.py\n@@ -23,7 +23,7 @@ class Config:\n     MAIL_PASSWORD = os.environ.get(\"MAIL_PASSWORD\", None)\n     MAIL_DEFAULT_SENDER = os.environ.get(\"MAIL_SENDER\", os.environ.get(\"MAIL_USERNAME\"))\n \n-    CACHE_TYPE = \"NullCache\"\n+    CACHE_TYPE = \"SimpleCache\"\n     CACHE_DEFAULT_TIMEOUT = 300\n \n     BASE_DIR = os.path.abspath(os.path.join(os.path.dirname(__file__), \"..\"))\ndiff --git a/postmortem.md b/postmortem.md\nnew file mode 100644\nindex 0000000..842ae0d\n--- /dev/null\n+++ b/postmortem.md\n@@ -0,0 +1,14 @@\n+# Incident Postmortem: EdgeClientRequestJitter & BooklogrApiLatencyP99High\n+\n+## Root Cause\n+In commit f1276612df15d0d449189c35201443746ce7e24 (\"Disable response caching\"), CACHE_TYPE in api/config.py was set to \"NullCache\" (disabling Flask response caching, which previously used \"SimpleCache\").\n+\n+When caching was disabled, every request to /v1/books/search triggered BookProvider().search(). The primary provider lookup attempted to query OpenLibrary (https://openlibrary.org), which was unreachable in this environment and timed out after 30 seconds. Because Gunicorn operates with 4 workers (-w 4), incoming search traffic from the edge client quickly exhausted all worker threads while waiting on 30-second socket timeouts. This worker thread starvation led to severe request queuing, high p99 latency (>2.4s), and flapping request jitter on edge-client.\n+\n+## Evidence Used\t\n+1. Alertmanager alert BooklogrApiLatencyP99High reporting p99 HTTP request latency of 2.485s (threshold 300ms) on booklogr-api.\n+2. Prometheus query metrics showing /v1/books/search averaging >1.2s per request due to repeated external metadata provider timeouts.\n+3. Git commit history showing commit f1276612df15d0d449189c35201443746ce7e24 which modified api/config.py from CACHE_TYPE = \"SimpleCache\" to CACHE_TYPE = \"NullCache\".\n+\n+## Key Changes Made\n+- Modified api/config.py to restore CACHE_TYPE = \"SimpleCache\", enabling Flask response caching for search results and alleviating worker thread starvation.\n",
    "duration_ms": 2635,
    "submitted": true
  },
  "trigger": {
    "alert_name": "BooklogrApiLatencyP99High",
    "annotations": {
      "description": "p99 HTTP request latency is 2.484s (threshold 300ms) for the booklogr-api service.",
      "summary": "High p99 request latency on booklogr-api"
    },
    "fired_at": "2026-07-22T12:46:06.403162381Z",
    "labels": {
      "alertname": "BooklogrApiLatencyP99High",
      "service": "booklogr-api",
      "severity": "critical"
    },
    "severity": "critical",
    "source": "prometheus-alert"
  },
  "verdict": "passed"
}
