{
  "agent_transcript": {
    "captured_at": "2026-07-22T21:05:37.194Z",
    "harness": "agy",
    "model": "Gemini 3.6 Flash (High)",
    "provider": "antigravity",
    "run_id": "campaign-decoy-3",
    "schema_version": "agent-transcript.v1",
    "session": "cold",
    "submitted": true
  },
  "ci": {
    "duration_ms": 55709,
    "green": true,
    "output": "CI success for c2d52d07 (http://localhost:3000/booklogr/booklogr/actions/runs/549)"
  },
  "deploy": {
    "duration_ms": 42046,
    "redeployed": true,
    "service": "booklogr-api"
  },
  "diff": "diff --git a/api/config.py b/api/config.py\nindex 81bf3a4..67f10ac 100644\n--- a/api/config.py\n+++ b/api/config.py\n@@ -13,7 +13,7 @@ class Config:\n     GOOGLE_CLIENT_SECRET = os.environ.get(\"GOOGLE_CLIENT_SECRET\", None)\n     SINGLE_USER_MODE = os.environ.get(\"SINGLE_USER_MODE\", \"False\")\n     AUTH_REQUIRE_VERIFICATION = os.environ.get(\"AUTH_REQUIRE_VERIFICATION\", \"False\")\n-    DATA_PROVIDER = os.environ.get(\"DATA_PROVIDER\", \"openlibrary\")\n+    DATA_PROVIDER = os.environ.get(\"DATA_PROVIDER\", \"http://book-metadata:8080\")\n     DATA_PROVIDER_FALLBACK = os.environ.get(\"DATA_PROVIDER_FALLBACK\", \"https://metadata.booklogr.app\")\n     \n     MAIL_SERVER = os.environ.get(\"MAIL_SERVER\", None)\ndiff --git a/api/routes/books.py b/api/routes/books.py\nindex 2f26c2a..d8c071b 100644\n--- a/api/routes/books.py\n+++ b/api/routes/books.py\n@@ -37,7 +37,7 @@ class SearchResult:\n \n @books_endpoint.route(\"/v1/books/search\", methods=[\"GET\"])\n @auth_required()\n-@cache.cached(query_string=True, key_prefix=lambda: f\"view/{get_current_user_id()}/{request.path}\")\n+@cache.cached(query_string=True, key_prefix=lambda: f\"view/{get_current_user_id()}/{request.full_path}\")\n def search_books():\n     search_term = request.args.get('q', '')\n     if not search_term:\ndiff --git a/postmortem.md b/postmortem.md\nnew file mode 100644\nindex 0000000..7410625\n--- /dev/null\n+++ b/postmortem.md\n@@ -0,0 +1,18 @@\n+# Postmortem: EdgeClientRequestJitter & BooklogrApiLatencyP99High\n+\n+## Root Cause\n+1. **Cache Key Scope Bug in Book Search Route (`api/routes/books.py`)**:\n+   Commit `8c580a7` updated the Flask-Caching decorator `@cache.cached` on `/v1/books/search` to use `key_prefix=lambda: f\"view/{get_current_user_id()}/{request.path}\"`. In Flask-Caching, when `key_prefix` is a callable/lambda, Flask-Caching evaluates `key_prefix()` to construct the cache key. Because `request.path` (`/v1/books/search`) excludes the query string (`?q=...`), every search query for a user evaluated to the exact same cache key (`view/{user_id}/v1/books/search`), causing stale cache hits across different search terms and collapsing inbound request volume to the upstream metadata provider (`BookMetadataTrafficStalled`).\n+\n+2. **Uncached Lookup Latency (`api/config.py`)**:\n+   `DATA_PROVIDER` defaulted to `\"openlibrary\"`, causing uncached search queries to execute WAN HTTP calls to `https://openlibrary.org/search.json` (taking 1.35s - 2.5s per request), saturating Gunicorn workers and driving high p99 HTTP request latency on `booklogr-api` (firing `BooklogrApiLatencyP99High`).\n+\n+## Evidence\n+- Prometheus rules `/api/v1/rules` showed `BooklogrApiLatencyP99High` firing with p99 latency ~2.485s (threshold 0.3s) and `BookMetadataTrafficStalled`.\n+- Prometheus metric `flask_http_request_duration_seconds_sum` and `flask_http_request_duration_seconds_bucket` confirmed `/v1/books/search` was the bottleneck, averaging ~1.35s - 2.5s per request.\n+- Direct test curling `http://book-metadata:8080/v1/search/dune` responded in <3ms, confirming the local metadata service is fast and reachable.\n+- Git log inspection (`git log -p ./api/routes/books.py`) revealed commit `8c580a7` introduced `request.path` in the cache key lambda.\n+\n+## Changes Made\n+- Modified `api/routes/books.py` to use `request.full_path` in `key_prefix=lambda: f\"view/{get_current_user_id()}/{request.full_path}\"` so search cache keys include query parameters (`?q=...`).\n+- Modified `api/config.py` default for `DATA_PROVIDER` from `\"openlibrary\"` to `\"http://book-metadata:8080\"` so metadata queries target the local fast container.\n",
  "finished_at": "2026-07-22T21:17:19.143Z",
  "full_record_sha256": "2e19add0a8a0df109a6f34cc67921584954b51df39aab389c642d520e340db57",
  "kind": "run-record",
  "profile": "incident",
  "record_version": "1.0.0",
  "run_id": "campaign-decoy-3",
  "scenario_id": "decoy-deploy-control",
  "score": {
    "oracle_id": "mitigation",
    "passed": false,
    "score": 0.35,
    "signals": [
      {
        "detail": "CI build + existing tests passed",
        "id": "ci_green",
        "satisfied": true,
        "value": 1,
        "weight": 0.25
      },
      {
        "detail": "alert BooklogrApiLatencyP99High cleared within budget",
        "id": "alert_cleared",
        "satisfied": false,
        "value": 0,
        "weight": 0.35
      },
      {
        "detail": "alert stayed cleared for 360s",
        "id": "sustained_clear",
        "satisfied": false,
        "value": 0,
        "weight": 0.2
      },
      {
        "detail": "did not clear",
        "id": "time_to_clear",
        "satisfied": false,
        "value": 0,
        "weight": 0.1
      },
      {
        "detail": "no regression alerts",
        "id": "no_new_alerts",
        "satisfied": true,
        "value": 1,
        "weight": 0.1
      }
    ]
  },
  "started_at": "2026-07-22T21:05:37.825Z",
  "timings": {
    "ci": 55710,
    "context": 0,
    "merge": 371,
    "redeploy": 42046,
    "run": 2637,
    "trigger": 33,
    "verify": 600520
  },
  "trajectory": {
    "agent_name": "external",
    "diff": "diff --git a/api/config.py b/api/config.py\nindex 81bf3a4..67f10ac 100644\n--- a/api/config.py\n+++ b/api/config.py\n@@ -13,7 +13,7 @@ class Config:\n     GOOGLE_CLIENT_SECRET = os.environ.get(\"GOOGLE_CLIENT_SECRET\", None)\n     SINGLE_USER_MODE = os.environ.get(\"SINGLE_USER_MODE\", \"False\")\n     AUTH_REQUIRE_VERIFICATION = os.environ.get(\"AUTH_REQUIRE_VERIFICATION\", \"False\")\n-    DATA_PROVIDER = os.environ.get(\"DATA_PROVIDER\", \"openlibrary\")\n+    DATA_PROVIDER = os.environ.get(\"DATA_PROVIDER\", \"http://book-metadata:8080\")\n     DATA_PROVIDER_FALLBACK = os.environ.get(\"DATA_PROVIDER_FALLBACK\", \"https://metadata.booklogr.app\")\n     \n     MAIL_SERVER = os.environ.get(\"MAIL_SERVER\", None)\ndiff --git a/api/routes/books.py b/api/routes/books.py\nindex 2f26c2a..d8c071b 100644\n--- a/api/routes/books.py\n+++ b/api/routes/books.py\n@@ -37,7 +37,7 @@ class SearchResult:\n \n @books_endpoint.route(\"/v1/books/search\", methods=[\"GET\"])\n @auth_required()\n-@cache.cached(query_string=True, key_prefix=lambda: f\"view/{get_current_user_id()}/{request.path}\")\n+@cache.cached(query_string=True, key_prefix=lambda: f\"view/{get_current_user_id()}/{request.full_path}\")\n def search_books():\n     search_term = request.args.get('q', '')\n     if not search_term:\ndiff --git a/postmortem.md b/postmortem.md\nnew file mode 100644\nindex 0000000..7410625\n--- /dev/null\n+++ b/postmortem.md\n@@ -0,0 +1,18 @@\n+# Postmortem: EdgeClientRequestJitter & BooklogrApiLatencyP99High\n+\n+## Root Cause\n+1. **Cache Key Scope Bug in Book Search Route (`api/routes/books.py`)**:\n+   Commit `8c580a7` updated the Flask-Caching decorator `@cache.cached` on `/v1/books/search` to use `key_prefix=lambda: f\"view/{get_current_user_id()}/{request.path}\"`. In Flask-Caching, when `key_prefix` is a callable/lambda, Flask-Caching evaluates `key_prefix()` to construct the cache key. Because `request.path` (`/v1/books/search`) excludes the query string (`?q=...`), every search query for a user evaluated to the exact same cache key (`view/{user_id}/v1/books/search`), causing stale cache hits across different search terms and collapsing inbound request volume to the upstream metadata provider (`BookMetadataTrafficStalled`).\n+\n+2. **Uncached Lookup Latency (`api/config.py`)**:\n+   `DATA_PROVIDER` defaulted to `\"openlibrary\"`, causing uncached search queries to execute WAN HTTP calls to `https://openlibrary.org/search.json` (taking 1.35s - 2.5s per request), saturating Gunicorn workers and driving high p99 HTTP request latency on `booklogr-api` (firing `BooklogrApiLatencyP99High`).\n+\n+## Evidence\n+- Prometheus rules `/api/v1/rules` showed `BooklogrApiLatencyP99High` firing with p99 latency ~2.485s (threshold 0.3s) and `BookMetadataTrafficStalled`.\n+- Prometheus metric `flask_http_request_duration_seconds_sum` and `flask_http_request_duration_seconds_bucket` confirmed `/v1/books/search` was the bottleneck, averaging ~1.35s - 2.5s per request.\n+- Direct test curling `http://book-metadata:8080/v1/search/dune` responded in <3ms, confirming the local metadata service is fast and reachable.\n+- Git log inspection (`git log -p ./api/routes/books.py`) revealed commit `8c580a7` introduced `request.path` in the cache key lambda.\n+\n+## Changes Made\n+- Modified `api/routes/books.py` to use `request.full_path` in `key_prefix=lambda: f\"view/{get_current_user_id()}/{request.full_path}\"` so search cache keys include query parameters (`?q=...`).\n+- Modified `api/config.py` default for `DATA_PROVIDER` from `\"openlibrary\"` to `\"http://book-metadata:8080\"` so metadata queries target the local fast container.\n",
    "duration_ms": 2637,
    "submitted": true
  },
  "trigger": {
    "alert_name": "BooklogrApiLatencyP99High",
    "annotations": {
      "description": "p99 HTTP request latency is 2.484s (threshold 300ms) for the booklogr-api service.",
      "summary": "High p99 request latency on booklogr-api"
    },
    "fired_at": "2026-07-22T20:55:56.403162381Z",
    "labels": {
      "alertname": "BooklogrApiLatencyP99High",
      "service": "booklogr-api",
      "severity": "critical"
    },
    "severity": "critical",
    "source": "prometheus-alert"
  },
  "verdict": "failed"
}
